{"dependencies":[{"dependency_kind":"interface","interface_output":"fee_final","ir_hash":"sha256:4d9bf4a7741cc92df0185f607e6f4364fb63f9e98c55df433b579756870fb871","name":"fee_final","object_id":"fee_index_v1","object_version":"v1"}],"lock_hash":"sha256:70019d4207576ddd9c2f29b62b6bda9055fe1daf090c0256b170b0e85f4a6a85","object_hash":"sha256:5dda1237873fa880e49b26cf62797f542b3cb195b434c12b35b70b8a59be023f","object_name":"FeeNote","object_version":"v1","schema":"zenodex/fire-object-lock/v1"}